,caption,image_path,subset,split,pathology,roi_text,noisy_text,corrected_text,med_umls_ids,magnification,height,width,not_histology,single_wsi
0,"Peritoneum, Day 4 These two biopsies (1 & 2) were taken from the same patient. What is your DailyDx of each of these peritoneal biopsies? What other finding is most likely to be present in this patient? Answers & quick facts tomorrow! UMichPath SurgPath",994701482116173824_0.jpg,openpath,train,,,,,,,,,0,1
2,Nephrogenic systemic fibrosis is a fibrotic disorder with deep involvement that goes down to the fascia.,dTr3MNl1FxE_image_c54e9a8d-9348-456a-9645-3b8921eb0b79.jpg,quilt,train,"['Dermatopathology', 'Soft tissue', 'Breast']",[]," some eosinophils in there as well. So just remember that. And again, maybe at some point in the future that may be some kind of therapeutic intervention, but you almost always see plasma cells when you get these sclerosing disorders. So I would recommend knowing those. I would also know some of the other conditions that you can get sclerosis in that are not really classically related to morphia, scleroderma form change that you see with some cases of chronic PCT, graft versus host disease, toxic oil, L-tryptophan deficiency, and then the differential diagnosis of nephrogenic systemic fibrosis, even though we don't see that many cases anymore of that today, because gadolinium isn't really being used as much as it used to be. That's not really a sclerotic disorder. It's a fibrotic disorder, but it also gives you very thick, deep involvement that goes all the way down to the fascia and even"," some eosinophils in there as well. So just remember that. And again, maybe at some point in the future that may be some kind of therapeutic intervention, but you almost always see plasma cells when you get these sclerotic disorders. So I would recommend knowing those. I would also know some of the other conditions that you can get sclerosis in that are not really classically related to morphia, scleroderma form change that you see with some cases of chronic PCT, graft versus host disease, toxic oil, L-tryptophan deficiency, and then the differential diagnosis of nephrogenic systemic fibrosis, even though we don't see that many cases anymore of that today, because gadolinium isn't really being used as much as it used to be. That's not really a sclerotic disorder. It's a fibrotic disorder, but it also gives you very thick, deep involvement that goes all the way down to the fascia and even","[[{'entity': 'Presence', 'concept_id': 'C0150312', 'confidence': 1.0}, {'entity': 'eosinophils', 'concept_id': 'C0014467', 'confidence': 1.0}, {'entity': 'plasma cells', 'concept_id': 'C0032112', 'confidence': 1.0}, {'entity': 'sclerotic disorders', 'concept_id': 'C0036412', 'confidence': 0.837680995464325}], [{'entity': 'Sclerosis', 'concept_id': 'C0036429', 'confidence': 1.0}, {'entity': 'conditions', 'concept_id': 'C0012634', 'confidence': 0.8556983470916748}, {'entity': 'morphia', 'concept_id': 'C0026549', 'confidence': 1.0}, {'entity': 'scleroderma', 'concept_id': 'C0011644', 'confidence': 1.0}, {'entity': 'chronic PCT', 'concept_id': 'C0205191', 'confidence': 0.6530080437660217}, {'entity': 'graft', 'concept_id': 'C0181074', 'confidence': 1.0}, {'entity': 'host disease', 'concept_id': 'C0162698', 'confidence': 0.7973175644874573}, {'entity': 'toxic oil', 'concept_id': 'C0409998', 'confidence': 0.7697754502296448}, {'entity': 'L-tryptophan deficiency', 'concept_id': 'C4317126', 'confidence': 0.7804175615310669}, {'entity': 'nephrogenic', 'concept_id': 'C1320468', 'confidence': 0.8878021836280823}], [{'entity': 'Nephrogenic', 'concept_id': 'C1320468', 'confidence': 0.8878021836280823}, {'entity': 'systemic fibrosis', 'concept_id': 'C0263669', 'confidence': 0.8302077054977417}, {'entity': 'fibrotic disorder', 'concept_id': 'C0406570', 'confidence': 0.8541455268859863}, {'entity': 'deep involvement', 'concept_id': 'C1314939', 'confidence': 0.8176997900009155}, {'entity': 'fascia', 'concept_id': 'C0015641', 'confidence': 1.0}]]",0.0,1040.0,1920.0,0,0
17,Cytosolic Sulfotransferase 1A1 /SULT1A1 Antibody,00004000040081.jpg,laion,train,,,,,,,,,0,1
33,"The immunocytochemistry of IDH1 in MG63 and U2OS. IDH1 is specifically detected in the cytoplasm of both osteosarcoma cell lines MG63 and U2OS.(A) Expression of IDH1 in U2OS, × 200; (B) Expression of IDH1 in MG63,× 200; (C) Expression of IDH1 in U2OS,× 400; (D) Expression of IDH1 in MG63,× 400.",c901a42b-0ab9-45d9-809d-dd646effcf9c_1.jpg,pubmed,train,,,,,,,,,0,1
1,"Teenager with a large hemispheric tumor.""PNET""-like morphology, with Olig2 negative and ATRX loss. What is the most likely diagnosis?PathTwitter neuropath neurotwitter",1574546082503139328_0.png,openpath,train,,,,,,,,,0,1
3,"The breast tissue shows hyperplasia, which is a normal finding in pregnancy.",YC5jOhcQGes_image_ede69e4d-0be4-4a06-a522-0c07528609eb.jpg,quilt,train,"['Breast', 'Gynecologic', 'Soft tissue']",['Breast tissue with hyperplasia'], tissue. So this is totally consistent with hyperplasia which is a normal type of hyperplasia of pregnancy. Also notice that there is very little by way of secreted milk material within these acini. There may be a little bit but for the most part they're not distended like thyroid follicles with milk. So the although this is a pregnant breast there is probably not a significant amount of lactation here. That's all I want to say about this case., tissue. So this is totally consistent with hyperplasia which is a normal type of hyperplasia of pregnancy. Also notice that there is very little by way of secreted milk material within these acini. There may be a little bit but for the most part they're not distended like thyroid follicles with milk. So the although this is a pregnant breast there is probably not a significant amount of lactation here. That's all I want to say about this case.,"[[{'entity': 'breast tissue', 'concept_id': 'C0444070', 'confidence': 0.9999998807907104}, {'entity': 'hyperplasia', 'concept_id': 'C0020507', 'confidence': 1.0}, {'entity': 'pregnancy', 'concept_id': 'C0032961', 'confidence': 1.0}], [{'entity': 'secreted', 'concept_id': 'C1327616', 'confidence': 1.0}, {'entity': 'milk material', 'concept_id': 'C0026131', 'confidence': 0.7710185050964355}, {'entity': 'acini', 'concept_id': 'C0596030', 'confidence': 0.7628078460693359}, {'entity': 'minimal', 'concept_id': 'C0547040', 'confidence': 0.9999999403953552}, {'entity': 'lactation', 'concept_id': 'C0006147', 'confidence': 1.0}]]",1.0,480.0,522.0,0,1
4,"There is little secreted milk material in the acini, indicating minimal lactation.",YC5jOhcQGes_image_ede69e4d-0be4-4a06-a522-0c07528609eb.jpg,quilt,train,"['Breast', 'Gynecologic', 'Soft tissue']",['Breast tissue with hyperplasia'], tissue. So this is totally consistent with hyperplasia which is a normal type of hyperplasia of pregnancy. Also notice that there is very little by way of secreted milk material within these acini. There may be a little bit but for the most part they're not distended like thyroid follicles with milk. So the although this is a pregnant breast there is probably not a significant amount of lactation here. That's all I want to say about this case., tissue. So this is totally consistent with hyperplasia which is a normal type of hyperplasia of pregnancy. Also notice that there is very little by way of secreted milk material within these acini. There may be a little bit but for the most part they're not distended like thyroid follicles with milk. So the although this is a pregnant breast there is probably not a significant amount of lactation here. That's all I want to say about this case.,"[[{'entity': 'breast tissue', 'concept_id': 'C0444070', 'confidence': 0.9999998807907104}, {'entity': 'hyperplasia', 'concept_id': 'C0020507', 'confidence': 1.0}, {'entity': 'pregnancy', 'concept_id': 'C0032961', 'confidence': 1.0}], [{'entity': 'secreted', 'concept_id': 'C1327616', 'confidence': 1.0}, {'entity': 'milk material', 'concept_id': 'C0026131', 'confidence': 0.7710185050964355}, {'entity': 'acini', 'concept_id': 'C0596030', 'confidence': 0.7628078460693359}, {'entity': 'minimal', 'concept_id': 'C0547040', 'confidence': 0.9999999403953552}, {'entity': 'lactation', 'concept_id': 'C0006147', 'confidence': 1.0}]]",1.0,480.0,522.0,0,1
5,"(1/6) MF in large cell transformation IHC stains show positivity for CD3 (top right), CD4 (bottom left) and CD5 (bottom right) in the large neoplastic cellshemepath lymsm PathTwitter hemepathMDA",1329227841582624769_3.jpg,openpath,train,,,,,,,,,0,1
6,Nondescript cells with hyperchromatic nuclei and pleomorphic nuclear features.,rdYF1iLJvrs_image_d18cb277-2e5b-4263-a618-aac2302e3352.jpg,quilt,train,"['Hematopathology', 'Dermatopathology', 'Head and Neck']",[]," These cells, let's take a look at them, are, again, similarly kind of small to medium in size. Nondescript, they're hyperchromatic nuclei. They have probably a little bit more pleomorphic nuclear features compared to the last case that we just looked at. As well, there's no real architecture to this, so, again, we kind of need a little bit of more IHC to guide us for this. I guess another thing just to point out is that"," These cells, let's take a look at them, are, again, similarly kind of small to medium in size. Nondescript, they're hyperchromatic nuclei. They have probably a little bit more pleomorphic nuclear features compared to the last case that we just looked at. As well, there's no real architecture to this, so, again, we kind of need a little bit of more IHC to guide us for this. I guess another thing just to point out is that","[[{'entity': 'Nondescript cells', 'concept_id': 'C1865791', 'confidence': 0.6172241568565369}, {'entity': 'hyperchromatic nuclei', 'concept_id': 'C3553776', 'confidence': 1.0}, {'entity': 'pleomorphic', 'concept_id': 'C1514164', 'confidence': 1.0}], [{'entity': 'No real', 'concept_id': 'C0237400', 'confidence': 0.7951179146766663}, {'entity': 'architecture', 'concept_id': 'C0003737', 'confidence': 1.0}, {'entity': 'cells', 'concept_id': 'C0007584', 'confidence': 0.9999999403953552}], [{'entity': 'IHC', 'concept_id': 'C0021044', 'confidence': 1.0}, {'entity': 'diagnosis', 'concept_id': 'C0011900', 'confidence': 0.9999998807907104}]]",2.0,1080.0,1920.0,0,0
7,No real architecture to the cells.,rdYF1iLJvrs_image_d18cb277-2e5b-4263-a618-aac2302e3352.jpg,quilt,train,"['Hematopathology', 'Dermatopathology', 'Head and Neck']",[]," These cells, let's take a look at them, are, again, similarly kind of small to medium in size. Nondescript, they're hyperchromatic nuclei. They have probably a little bit more pleomorphic nuclear features compared to the last case that we just looked at. As well, there's no real architecture to this, so, again, we kind of need a little bit of more IHC to guide us for this. I guess another thing just to point out is that"," These cells, let's take a look at them, are, again, similarly kind of small to medium in size. Nondescript, they're hyperchromatic nuclei. They have probably a little bit more pleomorphic nuclear features compared to the last case that we just looked at. As well, there's no real architecture to this, so, again, we kind of need a little bit of more IHC to guide us for this. I guess another thing just to point out is that","[[{'entity': 'Nondescript cells', 'concept_id': 'C1865791', 'confidence': 0.6172241568565369}, {'entity': 'hyperchromatic nuclei', 'concept_id': 'C3553776', 'confidence': 1.0}, {'entity': 'pleomorphic', 'concept_id': 'C1514164', 'confidence': 1.0}], [{'entity': 'No real', 'concept_id': 'C0237400', 'confidence': 0.7951179146766663}, {'entity': 'architecture', 'concept_id': 'C0003737', 'confidence': 1.0}, {'entity': 'cells', 'concept_id': 'C0007584', 'confidence': 0.9999999403953552}], [{'entity': 'IHC', 'concept_id': 'C0021044', 'confidence': 1.0}, {'entity': 'diagnosis', 'concept_id': 'C0011900', 'confidence': 0.9999998807907104}]]",2.0,1080.0,1920.0,0,0
8,Further IHC is needed to guide diagnosis.,rdYF1iLJvrs_image_d18cb277-2e5b-4263-a618-aac2302e3352.jpg,quilt,train,"['Hematopathology', 'Dermatopathology', 'Head and Neck']",[]," These cells, let's take a look at them, are, again, similarly kind of small to medium in size. Nondescript, they're hyperchromatic nuclei. They have probably a little bit more pleomorphic nuclear features compared to the last case that we just looked at. As well, there's no real architecture to this, so, again, we kind of need a little bit of more IHC to guide us for this. I guess another thing just to point out is that"," These cells, let's take a look at them, are, again, similarly kind of small to medium in size. Nondescript, they're hyperchromatic nuclei. They have probably a little bit more pleomorphic nuclear features compared to the last case that we just looked at. As well, there's no real architecture to this, so, again, we kind of need a little bit of more IHC to guide us for this. I guess another thing just to point out is that","[[{'entity': 'Nondescript cells', 'concept_id': 'C1865791', 'confidence': 0.6172241568565369}, {'entity': 'hyperchromatic nuclei', 'concept_id': 'C3553776', 'confidence': 1.0}, {'entity': 'pleomorphic', 'concept_id': 'C1514164', 'confidence': 1.0}], [{'entity': 'No real', 'concept_id': 'C0237400', 'confidence': 0.7951179146766663}, {'entity': 'architecture', 'concept_id': 'C0003737', 'confidence': 1.0}, {'entity': 'cells', 'concept_id': 'C0007584', 'confidence': 0.9999999403953552}], [{'entity': 'IHC', 'concept_id': 'C0021044', 'confidence': 1.0}, {'entity': 'diagnosis', 'concept_id': 'C0011900', 'confidence': 0.9999998807907104}]]",2.0,1080.0,1920.0,0,0
9,"Orthokeratosis, parakeratosis, and neutrophils are seen in psoriasis.",wK1VZ8lnQLM_image_63c2e228-b520-4bf1-8e71-4e1e0a16063c.jpg,quilt,train,"['Dermatopathology', 'Soft tissue', 'Hematopathology']","['neutrophils', 'orthokeratosis', 'parakeratosis', 'neutrophils']"," so that would fit quite nicely. And if we look here, there are the neutrophils, and I don't know whether, there's a times 40, and so you can see orthokeratosis, parakeratosis and neutrophils in the middle. And we're going to go back just to the lower power, because I wanted just to have a little look at the vessels, because they're an important and integral part of diagnosing any variant of psoriasis, so let's look at those at very high power."," so that would fit quite nicely. And if we look here, there are the neutrophils, and I don't know whether, there's a times 40, and so you can see orthokeratosis, parakeratosis and neutrophils in the middle. And we're going to go back just to the lower power, because I wanted just to have a little look at the vessels, because they're an important and integral part of diagnosing any variant of psoriasis, so let's look at those at very high power.","[[{'entity': 'Orthokeratosis', 'concept_id': 'C1843359', 'confidence': 1.0}, {'entity': 'parakeratosis', 'concept_id': 'C0030436', 'confidence': 1.0}, {'entity': 'neutrophils', 'concept_id': 'C0027950', 'confidence': 1.0}, {'entity': 'psoriasis', 'concept_id': 'C0033860', 'confidence': 1.0}], [{'entity': 'Vessels', 'concept_id': 'C0005847', 'confidence': 1.0}, {'entity': 'diagnosing', 'concept_id': 'C0011900', 'confidence': 1.0}, {'entity': 'psoriasis', 'concept_id': 'C0033860', 'confidence': 1.0}]]",0.0,1080.0,1920.0,0,1
10,The spindle cells have pink collagen in the background.,oNdYlB4vkFc_image_94ae44c7-ee6b-4588-8620-9615be4fd656.jpg,quilt,train,"['Genitourinary', 'Gynecologic', 'Hematopathology']",[], I or the other normal that I showed you but you can tell that these spindle cells they have pink collagen in the background here at high power with the condenser flipped you can see that they're very much have that wavy ramen noodle pattern to the background collagen fibers the nuclei are not all that wavy some of them are but the collagen fibers certainly are wavy and there's also this kind of bluish purple cytoplasm at each end of the nucleus and again that myofibroblast versus smooth muscle video we'll talk more about that but this is a myofibroblastic process this is scar okay so that we've got parallel fascicles of of myofibroblast, I or the other normal that I showed you but you can tell that these spindle cells they have pink collagen in the background here at high power with the condenser flipped you can see that they're very much have that wavy ramen noodle pattern to the background collagen fibers the nuclei are not all that wavy some of them are but the collagen fibers certainly are wavy and there's also this kind of bluish purple cytoplasm at each end of the nucleus and again that myofibroblast versus smooth muscle video we'talk more about that but this is a myofibroblastic process this is scar okay so that we've got parallel fascicles of of myofibroblast,"[[{'entity': 'spindle cells', 'concept_id': 'C0682540', 'confidence': 1.0}, {'entity': 'pink', 'concept_id': 'C0332585', 'confidence': 1.0}, {'entity': 'collagen', 'concept_id': 'C0009325', 'confidence': 0.9999998807907104}, {'entity': 'background', 'concept_id': 'C1706907', 'confidence': 1.0}], [{'entity': 'collagen', 'concept_id': 'C0009325', 'confidence': 0.9999998807907104}, {'entity': 'fibers', 'concept_id': 'C0000696', 'confidence': 0.9201323986053467}, {'entity': 'wavy pattern', 'concept_id': 'C0449774', 'confidence': 0.6592518091201782}], [{'entity': 'cells', 'concept_id': 'C0007584', 'confidence': 0.9999999403953552}, {'entity': 'bluish-purple cytoplasm', 'concept_id': 'C0010834', 'confidence': 0.5215408205986023}, {'entity': 'nucleus', 'concept_id': 'C0007610', 'confidence': 1.0}], [{'entity': 'myofibroblastic process', 'concept_id': 'C0225360', 'confidence': 0.8315185308456421}, {'entity': 'scar tissue', 'concept_id': 'C0241158', 'confidence': 1.0}]]",2.0,1080.0,1920.0,0,0
11,"Histologically, a low grade malignancy like low grade chondrosarcoma with a biphasic or high grade area adjacent to or surrounding the lesion is observed.",_GRcnnXeE9c_image_330b933d-931f-4911-9dc6-e059f633871d.jpg,quilt,train,"['Bone', 'Soft tissue', 'Hematopathology']",['lucency around a lesion']," And the hallmarks are the radiographic findings of a change, changing symptoms, lucency around a more indolent lesion. And histologically, we look for a low grade lesion, low grade malignancy like this low grade chondrosarcoma with a biphasic or more high grade area adjacent to or surrounding that lesion. So our diagnosis on this case would be a de-differentiated chondrosarcoma arising from a low grade chondrosarcoma, probably a chondroid lesion that had been present for some time. Now, if our biopsy were just of this type of tissue, we certainly could render the diagnosis of a"," And the hallmarks are the radiographic findings of a change, changing symptoms, lucency around a more indolent lesion. And histologically, we look for a low grade lesion, low grade malignancy like this low grade chondrosarcoma with a biphasic or more high grade area adjacent to or surrounding that lesion. So our diagnosis on this case would be a de-differentiated chondrosarcoma arising from a low grade chondrosarcoma, probably a chondroid lesion that had been present for some time. Now, if our biopsy were just of this type of tissue, we certainly could render the diagnosis of a","[[{'entity': 'Radiographic', 'concept_id': 'C0444708', 'confidence': 1.0}, {'entity': 'findings', 'concept_id': 'C2607943', 'confidence': 1.0}, {'entity': 'changing', 'concept_id': 'C0392747', 'confidence': 1.0}, {'entity': 'symptoms', 'concept_id': 'C0683368', 'confidence': 1.0}, {'entity': 'hallmarks', 'concept_id': 'C0522501', 'confidence': 0.6871080994606018}, {'entity': 'dedifferentiated chondrosarcoma', 'concept_id': 'C0862878', 'confidence': 1.0}], [{'entity': 'Histologically', 'concept_id': 'C0205462', 'confidence': 1.0}, {'entity': 'low', 'concept_id': 'C0205251', 'confidence': 0.9999999403953552}, {'entity': 'low grade', 'concept_id': 'C1282907', 'confidence': 0.9999999403953552}, {'entity': 'biphasic', 'concept_id': 'C0205184', 'confidence': 1.0}, {'entity': 'high', 'concept_id': 'C0205250', 'confidence': 1.0}, {'entity': 'surrounding', 'concept_id': 'C1282914', 'confidence': 1.0}, {'entity': 'lesion', 'concept_id': 'C0221198', 'confidence': 0.9999998807907104}]]",0.0,1080.0,1920.0,0,0
12,Normoblasts also seem to be in the halloween2019 mood. hemepath HappyHalloween,1190033293669879809_0.jpg,openpath,train,,,,,,,,,0,1
13,"Passenger Merkel cells can be found in the background of desmoplastic trichoepithelioma and other follicular tumors, but not in the background of MAC or basal cells.",8WWhRTta8ZI_image_0ebb7e3a-f836-4148-b350-2e0a561735ff.jpg,quilt,train,"['Dermatopathology', 'Hematopathology', 'Soft tissue']","['Passenger Merkel cells', 'desmoplastic trichoepithelioma', 'MAC', 'basal cells', 'perineural invasion', 'Passenger Merkel cells', 'desmoplastic trichoepithelioma', 'MAC', 'basal cells', 'perineural invasion']", occasionally found useful it will stain scattered passenger Merkel cells in the background of desmoplastic tricolap and other follicular tumors and those cells are usually not present in the background of Mac or basal cells so I've I found that useful occasionally but most the time on a small biopsy no matter how many stains I do I'm still gonna hedge and still gonna tell them to re-excise so I usually just don't mess with it and I just say here's the differential re-excise I feel like a big enough sample and H&E is what I need more than a bunch of extra stains so that's my personal practical approach but you can read the literature there's lots of the fact that there are so many stains described to sort this out tells you that none of them work perfectly well and then it's hard that's what Dr. Ruppini said you got a bunch of different treatments for something it's because none of them work very well and I think the same is true for stains when we have to keep investigating new stains it's because they're all suboptimal in some way or another this is a good example of desmoplastic tricolap because we can see the tumors limited to the dermis if I see perineural invasion even though that has been described in desmoplastic tricolap by very good derm paths who I like and trust it still doesn't sit well with me in my soul I just don't like that idea of seeing perineural invasion of desmoplastic tricolap usually that's a feature that makes me strongly favor MAC okay so here's desmoplastic tricolap challenging diagnosis and what's that one another beauty tricoadenoma yeah and they're basically a, occasionally found useful it will stain scattered passenger Merkel cells in the background of desmoplastic trichoepithelioma and other follicular tumors and those cells are usually not present in the background of Mac or basal cells so I've I found that useful occasionally but most the time on a small biopsy no matter how many stains I do I'm still gonna hedge and still gonna tell them to re-excision so I usually just don't mess with it and I just say here's the differential re-excision I feel like a big enough sample and H&E is what I need more than a bunch of extra stains so that's my personal practical approach but you can read the literature there's lots of the fact that there are so many stains described to sort this out tells you that none of them work perfectly well and then it's hard that's what Dr. Rapini said you got a bunch of different treatments for something it's because none of them work very well and I think the same is true for stains when we have to keep investigating new stains it's because they're all suboptimal in some way or another this is a good example of desmoplastic trichoepithelioma because we can see the tumors limited to the dermis if I see perineural invasion even though that has been described in desmoplastic trichoepithelioma by very good derm paths who I like and trust it still doesn't sit well with me in my soul I just don't like that idea of seeing perineural invasion of desmoplastic trichoepithelioma usually that's a feature that makes me strongly favor MAC okay so here's desmoplastic trichoepithelioma challenging diagnosis and what's that one another beauty trichoepithelioma yeah and they're basically a,"[[{'entity': 'Passenger Merkel cells', 'concept_id': 'C0205832', 'confidence': 0.783627986907959}, {'entity': 'background', 'concept_id': 'C1706907', 'confidence': 1.0}, {'entity': 'desmoplastic trichoepithelioma', 'concept_id': 'C0432526', 'confidence': 1.0}, {'entity': 'follicular', 'concept_id': 'C0439682', 'confidence': 1.0}, {'entity': 'tumors', 'concept_id': 'C0027651', 'confidence': 1.0}, {'entity': 'background', 'concept_id': 'C1706907', 'confidence': 1.0}, {'entity': 'MAC', 'concept_id': 'C0009545', 'confidence': 0.9999999403953552}, {'entity': 'basal cells', 'concept_id': 'C0596155', 'confidence': 1.0}], [{'entity': 'Stains', 'concept_id': 'C0038128', 'confidence': 1.0}, {'entity': 'suboptimal', 'concept_id': 'C2984009', 'confidence': 1.0}, {'entity': 'diagnosing', 'concept_id': 'C0011900', 'confidence': 1.0}, {'entity': 'desmoplastic trichoepithelioma', 'concept_id': 'C0432526', 'confidence': 1.0}, {'entity': 'sample', 'concept_id': 'C0370003', 'confidence': 1.0}, {'entity': 'H&E', 'concept_id': 'C0523207', 'confidence': 1.0}, {'entity': 'staining', 'concept_id': 'C0487602', 'confidence': 1.0}], [{'entity': 'Perineural invasion', 'concept_id': 'C1317608', 'confidence': 1.0}, {'entity': 'desmoplastic trichoepithelioma', 'concept_id': 'C0432526', 'confidence': 1.0}, {'entity': 'presence', 'concept_id': 'C0150312', 'confidence': 1.0}, {'entity': 'MAC', 'concept_id': 'C0009545', 'confidence': 0.9999999403953552}], [{'entity': 'Desmoplastic trichoepithelioma', 'concept_id': 'C0432526', 'confidence': 1.0}, {'entity': 'diagnosis', 'concept_id': 'C0011900', 'confidence': 0.9999998807907104}]]",0.0,1080.0,1920.0,0,0
