,caption,image_path,subset,split,pathology,roi_text,noisy_text,corrected_text,med_umls_ids,magnification,height,width,not_histology,single_wsi
71,CD34 stain should always be used with S100 or Sox stain to avoid misdiagnosis.,13bLhmg0TIc_image_cceb1fcd-90a0-413c-a32b-0fff4ffaa7db.jpg,quilt,train,"['Dermatopathology', 'Neuropathology', 'Soft tissue']",[], seen people get confused about this and and raise the possibility of DFSP and if you know much about DFSP you know that the classic stain for it is CD34 well like we I think we mentioned earlier CD34 often strongly stains neurofibromas of all types because of either fibroblastic or dendritic cells in the mix of the lesion so CD34 positive it is going to be CD34 positive and honeycomb pattern of adipocyte entrapment and that'll easily make you misdiagnosis so if your differential is between diffuse neurofibroma and DFSP do an S100 stain or a sock stain because that's going to essentially never be positive in DFSP and it's going to always be positive in neurofibroma you can do a 34 also but make sure you don't do 34 by itself always use an S100 or a socks with it at least that's the recommendation I make to my residents and that's the way that I handle these cases in my, seen people get confused about this and and raise the possibility of DFSP and if you know much about DFSP you know that the classic stain for it is CD34 well like we I think we mentioned earlier CD34 often stain neurofibromas of all types because of either fibroblastic or dendritic cells in the mix of the lesion so CD34 positive it is going to be CD34 positive and honeycomb pattern of adipocyte entrapment and that'easily make you misdiagnosis so if your differential is between diffuse neurofibroma and DFSP do an S100 stain or a sock stain because that's going to essentially never be positive in DFSP and it's going to always be positive in neurofibroma you can do a 34 also but make sure you don't do 34 by itself always use an S100 or a socks with it at least that's the recommendation I make to my residents and that's the way that I handle these cases in my,"[[{'entity': 'CD34', 'concept_id': 'C0054953', 'confidence': 1.0}, {'entity': 'stain', 'concept_id': 'C0038128', 'confidence': 1.0}, {'entity': 'Dermatofibrosarcoma Protuberans', 'concept_id': 'C0206647', 'confidence': 1.0}, {'entity': 'DFSP', 'concept_id': 'C0392784', 'confidence': 1.0}, {'entity': 'stain', 'concept_id': 'C0038128', 'confidence': 1.0}, {'entity': 'neurofibromas', 'concept_id': 'C0027830', 'confidence': 1.0}], [{'entity': 'honeycomb', 'concept_id': 'C0332468', 'confidence': 1.0}, {'entity': 'pattern', 'concept_id': 'C0449774', 'confidence': 1.0}, {'entity': 'adipocyte', 'concept_id': 'C0206131', 'confidence': 1.0}, {'entity': 'entrapment', 'concept_id': 'C1285497', 'confidence': 1.0}, {'entity': 'DFSP', 'concept_id': 'C0392784', 'confidence': 1.0}, {'entity': 'diffuse', 'concept_id': 'C0205219', 'confidence': 1.0}, {'entity': 'neurofibroma', 'concept_id': 'C0027830', 'confidence': 1.0}, {'entity': 'misdiagnosis', 'concept_id': 'C0679838', 'confidence': 1.0}], [{'entity': 'S100 stain', 'concept_id': 'C0038128', 'confidence': 0.5782254338264465}, {'entity': 'Sox stain', 'concept_id': 'C0038128', 'confidence': 0.6327038407325745}, {'entity': 'DFSP', 'concept_id': 'C0392784', 'confidence': 1.0}, {'entity': 'neurofibroma', 'concept_id': 'C0027830', 'confidence': 1.0}, {'entity': 'negative', 'concept_id': 'C0205160', 'confidence': 0.9999999403953552}, {'entity': 'positive', 'concept_id': 'C1446409', 'confidence': 1.0}, {'entity': 'DFSP', 'concept_id': 'C0392784', 'confidence': 1.0}], [{'entity': 'CD34 stain', 'concept_id': 'C0038128', 'confidence': 0.5134490728378296}, {'entity': 'S100', 'concept_id': 'C3273837', 'confidence': 1.0}, {'entity': 'Sox stain', 'concept_id': 'C0038128', 'confidence': 0.6327038407325745}, {'entity': 'misdiagnosis', 'concept_id': 'C0679838', 'confidence': 1.0}]]",0.0,1080.0,1920.0,0,0
72,The altered myofibrillar architecture seen in an older stain around the phosphotungstic acid hematoxylin or PTAH can be helpful for recognition.,Di1ZY82A5Ys_image_c86aa9e0-d945-424a-9f9a-df60ec0281ed.jpg,quilt,train,"['Neuropathology', 'Soft tissue', 'Pediatric']","['central cores within a muscle biopsy', 'fiber size variation', 'paler areas in the center', 'aggregation of basophilic staining', 'disorganized myofibrils', 'no mitochondria within the core']"," for recognition. A diagnostic tip, if you've got an older stain around the phosphotungstic acid hematoxylin or PTAH, it can also be really helpful due to the altered myofibrillar architecture that you see within a core. And this is an example of central cores within a muscle biopsy. You can see there's definitely fiber size variation here. And then you see these areas that look a little bit paler in the center compared to the rest of the myofiber. And there's aggregation of basophilic staining around that. And that's because the mitochondria are all pushed out to the edge of this core. It's not really empty. Obviously it does have myofibrils within it, but they are disorganized and there's no mitochondria within that core. So here's our really helpful NADH staining. When you see this, it's great. You might"," for recognition. A diagnostic tip, if you've got an older stain around the phosphotungstic acid hematoxylin or PTAH, it can also be really helpful due to the altered myofibrillar architecture that you see within a core. And this is an example of central cores within a muscle biopsy. You can see there's definitely fiber size variation here. And then you see these areas that look a little bit paler in the center compared to the rest of the myofiber. And there's aggregation of basophilic staining around that. And that's because the mitochondria are all pushed out to the edge of this core. It's not really empty. Obviously it does have myofibrils within it, but they are disorganized and there's no mitochondria within that core. So here's our really helpful NADH staining. When you see this, it's great. You might","[[{'entity': 'myofibrillar', 'concept_id': 'C0027075', 'confidence': 0.9362509250640869}, {'entity': 'architecture', 'concept_id': 'C0003737', 'confidence': 1.0}, {'entity': 'older stain', 'concept_id': 'C0038128', 'confidence': 0.6514314413070679}, {'entity': 'phosphotungstic acid hematoxylin', 'concept_id': 'C0491956', 'confidence': 0.9224520325660706}, {'entity': 'PTAH', 'concept_id': 'C0404079', 'confidence': 0.7444499135017395}, {'entity': 'recognition', 'concept_id': 'C0524637', 'confidence': 1.0}], [{'entity': 'central cores', 'concept_id': 'C0333763', 'confidence': 1.0}, {'entity': 'muscle biopsy', 'concept_id': 'C0185283', 'confidence': 1.0}, {'entity': 'fiber size', 'concept_id': 'C1837325', 'confidence': 0.8214545249938965}, {'entity': 'variation', 'concept_id': 'C0205419', 'confidence': 1.0}, {'entity': 'aggregation', 'concept_id': 'C0332621', 'confidence': 1.0}, {'entity': 'basophilic staining', 'concept_id': 'C0333933', 'confidence': 0.7926127910614014}, {'entity': 'paler areas', 'concept_id': 'C0205146', 'confidence': 0.7000970244407654}, {'entity': 'center', 'concept_id': 'C0205099', 'confidence': 0.9999999403953552}], [{'entity': 'core', 'concept_id': 'C0444669', 'confidence': 0.9999999403953552}, {'entity': 'mitochondria', 'concept_id': 'C0026237', 'confidence': 1.0}, {'entity': 'disorganized', 'concept_id': 'C1300196', 'confidence': 0.8551687002182007}, {'entity': 'myofibrils', 'concept_id': 'C0027075', 'confidence': 0.9999999403953552}]]",0.0,1080.0,1920.0,0,0
73,The core has no mitochondria and disorganized myofibrils.,Di1ZY82A5Ys_image_c86aa9e0-d945-424a-9f9a-df60ec0281ed.jpg,quilt,train,"['Neuropathology', 'Soft tissue', 'Pediatric']","['central cores within a muscle biopsy', 'fiber size variation', 'paler areas in the center', 'aggregation of basophilic staining', 'disorganized myofibrils', 'no mitochondria within the core']"," for recognition. A diagnostic tip, if you've got an older stain around the phosphotungstic acid hematoxylin or PTAH, it can also be really helpful due to the altered myofibrillar architecture that you see within a core. And this is an example of central cores within a muscle biopsy. You can see there's definitely fiber size variation here. And then you see these areas that look a little bit paler in the center compared to the rest of the myofiber. And there's aggregation of basophilic staining around that. And that's because the mitochondria are all pushed out to the edge of this core. It's not really empty. Obviously it does have myofibrils within it, but they are disorganized and there's no mitochondria within that core. So here's our really helpful NADH staining. When you see this, it's great. You might"," for recognition. A diagnostic tip, if you've got an older stain around the phosphotungstic acid hematoxylin or PTAH, it can also be really helpful due to the altered myofibrillar architecture that you see within a core. And this is an example of central cores within a muscle biopsy. You can see there's definitely fiber size variation here. And then you see these areas that look a little bit paler in the center compared to the rest of the myofiber. And there's aggregation of basophilic staining around that. And that's because the mitochondria are all pushed out to the edge of this core. It's not really empty. Obviously it does have myofibrils within it, but they are disorganized and there's no mitochondria within that core. So here's our really helpful NADH staining. When you see this, it's great. You might","[[{'entity': 'myofibrillar', 'concept_id': 'C0027075', 'confidence': 0.9362509250640869}, {'entity': 'architecture', 'concept_id': 'C0003737', 'confidence': 1.0}, {'entity': 'older stain', 'concept_id': 'C0038128', 'confidence': 0.6514314413070679}, {'entity': 'phosphotungstic acid hematoxylin', 'concept_id': 'C0491956', 'confidence': 0.9224520325660706}, {'entity': 'PTAH', 'concept_id': 'C0404079', 'confidence': 0.7444499135017395}, {'entity': 'recognition', 'concept_id': 'C0524637', 'confidence': 1.0}], [{'entity': 'central cores', 'concept_id': 'C0333763', 'confidence': 1.0}, {'entity': 'muscle biopsy', 'concept_id': 'C0185283', 'confidence': 1.0}, {'entity': 'fiber size', 'concept_id': 'C1837325', 'confidence': 0.8214545249938965}, {'entity': 'variation', 'concept_id': 'C0205419', 'confidence': 1.0}, {'entity': 'aggregation', 'concept_id': 'C0332621', 'confidence': 1.0}, {'entity': 'basophilic staining', 'concept_id': 'C0333933', 'confidence': 0.7926127910614014}, {'entity': 'paler areas', 'concept_id': 'C0205146', 'confidence': 0.7000970244407654}, {'entity': 'center', 'concept_id': 'C0205099', 'confidence': 0.9999999403953552}], [{'entity': 'core', 'concept_id': 'C0444669', 'confidence': 0.9999999403953552}, {'entity': 'mitochondria', 'concept_id': 'C0026237', 'confidence': 1.0}, {'entity': 'disorganized', 'concept_id': 'C1300196', 'confidence': 0.8551687002182007}, {'entity': 'myofibrils', 'concept_id': 'C0027075', 'confidence': 0.9999999403953552}]]",0.0,1080.0,1920.0,0,0
74,The narrator discusses the presence of calcifications in abnormal elastic fibers that can be slightly brownish in color.,qQONmhOPMoM_image_a3200457-99de-4a50-868d-f25d65e98b60.jpg,quilt,train,"['Dermatopathology', 'Others', 'Soft tissue']","['Calcifications in abnormal elastic fibers', 'Membranous fat necrosis', 'Calcifications in abnormal elastic fibers', 'Membranous fat necrosis']"," Although it can be deep, often it'll replace the fat and it'll go deep and you can get calcifications in the little abnormal elastic fibers that can be slightly brownish in color in the little lollipop structure, so that would not be as good of an answer. And you usually don't see the membranous fat necrosis in that, which you see here also. So that wouldn't be a good choice. What about subcutaneous morphia? That's one thing that we could consider possibly, like a lipodystrophy sort of situation. You're thinking of something like maybe uncudicabra or something like that, variant of morphia? Possibly. Would that be good for this, do you like that one with this membranous fat necrosis change? No, because"," Although it can be deep, often it'replace the fat and it'll go deep and you can get calcifications in the little abnormal elastic fibers that can be slightly brownish in color in the little lollipop structure, so that would not be as good of an answer. And you usually don't see the membranous fat necrosis in that, which you see here also. So that wouldn't be a good choice. What about subcutaneous morphia? That's one thing that we could consider possibly, like a lipodystrophy sort of situation. You're thinking of something like maybe unclassifiable or something like that, variant of morphia? Possibly. Would that be good for this, do you like that one with this membranous fat necrosis change? No, because","[[{'entity': 'narrator', 'concept_id': 'C1135957', 'confidence': 0.7711340188980103}, {'entity': 'presence', 'concept_id': 'C0150312', 'confidence': 1.0}, {'entity': 'calcifications', 'concept_id': 'C0006660', 'confidence': 1.0}, {'entity': 'abnormal', 'concept_id': 'C0205161', 'confidence': 1.0}, {'entity': 'elastic fibers', 'concept_id': 'C0230899', 'confidence': 0.9999999403953552}, {'entity': 'brownish', 'concept_id': 'C0332578', 'confidence': 0.9247111678123474}, {'entity': 'color', 'concept_id': 'C0009393', 'confidence': 1.0}], [{'entity': 'narrator', 'concept_id': 'C1135957', 'confidence': 0.7711340188980103}, {'entity': 'membranous', 'concept_id': 'C0025255', 'confidence': 1.0}, {'entity': 'fat necrosis', 'concept_id': 'C0015668', 'confidence': 0.9999998807907104}]]",0.0,1080.0,1920.0,0,0
75,HNMT Antibody in Immunohistochemistry (IHC),00022000223881.jpg,laion,train,,,,,,,,,0,1
76,Good ti remember degenerated skeletal muscle fibers as mimickers of neoplasia. pathology bstpath,1485304878557802497_1.jpg,openpath,train,,,,,,,,,0,1
77,"HistopathologyClear cell renal cell carcinoma in intravascular thrombus (A) with histologic appearance similar to that of original renal cell carcinoma (B). (Hematoxylin & eosin staining, ×200.)",86e0bd9f-0803-4d7e-9fdc-5c8f7610928a_0.jpg,pubmed,train,,,,,,,,,0,1
78,"Presence of distended nerves and multiple nodules, suggestive of neurofibromatosis type 1 (NF1).",V-NTBJpFKS0_image_2ead3fdf-ba7e-44bd-8955-1378c8fd5f35.jpg,quilt,train,"['Soft tissue', 'Dermatopathology', 'Neuropathology']","['distended nerves', 'multiple nodules', 'plexiform neurofibromas', 'diffuse neurofibroma']"," So we've got the distended nerves, multiple nodules, and also something I often see in the context of NF1 particularly is that plexiform neurofibromas often have areas of diffuse neurofibroma, that is this kind of trickling, intervening neurofibroma that trickles into the adipose tissue and wraps around normal structures. You often have plexiform and diffuse neurofibroma coexisting with one"," So we've got the distended nerves, multiple nodules, and also something I often see in the context of NF1 particularly is that plexiform neurofibromas often have areas of diffuse neurofibroma, that is this kind of trickling, intervening neurofibroma that trickles into the adipose tissue and wraps around normal structures. You often have plexiform and diffuse neurofibroma coexisting with one","[[{'entity': 'Presence', 'concept_id': 'C0150312', 'confidence': 1.0}, {'entity': 'distended nerves', 'concept_id': 'C0700124', 'confidence': 0.7606228590011597}, {'entity': 'multiple', 'concept_id': 'C0439064', 'confidence': 1.0}, {'entity': 'nodules', 'concept_id': 'C0028259', 'confidence': 1.0}, {'entity': 'neurofibromatosis type 1', 'concept_id': 'C0027831', 'confidence': 1.0}, {'entity': 'NF1', 'concept_id': 'C0027831', 'confidence': 0.9999999403953552}], [{'entity': 'Plexiform', 'concept_id': 'C0450207', 'confidence': 1.0}, {'entity': 'neurofibromas', 'concept_id': 'C0027830', 'confidence': 1.0}, {'entity': 'diffuse', 'concept_id': 'C0205219', 'confidence': 1.0}, {'entity': 'neurofibroma', 'concept_id': 'C0027830', 'confidence': 1.0}, {'entity': 'normal structures', 'concept_id': 'C0678594', 'confidence': 0.7832801342010498}]]",0.0,1080.0,1728.0,0,1
79,Plexiform neurofibromas can have areas of diffuse neurofibroma that wraps around normal structures.,V-NTBJpFKS0_image_2ead3fdf-ba7e-44bd-8955-1378c8fd5f35.jpg,quilt,train,"['Soft tissue', 'Dermatopathology', 'Neuropathology']","['distended nerves', 'multiple nodules', 'plexiform neurofibromas', 'diffuse neurofibroma']"," So we've got the distended nerves, multiple nodules, and also something I often see in the context of NF1 particularly is that plexiform neurofibromas often have areas of diffuse neurofibroma, that is this kind of trickling, intervening neurofibroma that trickles into the adipose tissue and wraps around normal structures. You often have plexiform and diffuse neurofibroma coexisting with one"," So we've got the distended nerves, multiple nodules, and also something I often see in the context of NF1 particularly is that plexiform neurofibromas often have areas of diffuse neurofibroma, that is this kind of trickling, intervening neurofibroma that trickles into the adipose tissue and wraps around normal structures. You often have plexiform and diffuse neurofibroma coexisting with one","[[{'entity': 'Presence', 'concept_id': 'C0150312', 'confidence': 1.0}, {'entity': 'distended nerves', 'concept_id': 'C0700124', 'confidence': 0.7606228590011597}, {'entity': 'multiple', 'concept_id': 'C0439064', 'confidence': 1.0}, {'entity': 'nodules', 'concept_id': 'C0028259', 'confidence': 1.0}, {'entity': 'neurofibromatosis type 1', 'concept_id': 'C0027831', 'confidence': 1.0}, {'entity': 'NF1', 'concept_id': 'C0027831', 'confidence': 0.9999999403953552}], [{'entity': 'Plexiform', 'concept_id': 'C0450207', 'confidence': 1.0}, {'entity': 'neurofibromas', 'concept_id': 'C0027830', 'confidence': 1.0}, {'entity': 'diffuse', 'concept_id': 'C0205219', 'confidence': 1.0}, {'entity': 'neurofibroma', 'concept_id': 'C0027830', 'confidence': 1.0}, {'entity': 'normal structures', 'concept_id': 'C0678594', 'confidence': 0.7832801342010498}]]",0.0,1080.0,1728.0,0,1
80,"The distribution of CD163-positive M2 macrophae and microvessel in Kazakh esophageal squamous cell carcinoma (ESCC) and Cancer adjacent normal (CAN) tissues(A–D) Immunohistochemical staining of CD163, which was used as a marker of M2 macrophages and to evaluate the density of M2 macrophages in ESCC and CAN tissues. (A) and (B) showed the distribution of M2 macrophages in ESCC tumor stromal and islet, CD163 revealed diffuse staining of membranes and cytoplasm of M2 macrophages, and showed the high density of M2 macrophages located in ESCC tissues (especially in tumor stroma). (C) and (D) showed the distribution of M2 macrophages in CAN stroma and epithelia. A small number of CD163-positive M2 macrophages appear in CAN tissues. (E and F) Immunohistochemical staining of CD34, which was used to mark endothelial cells and to evaluate the microvessel density (MVD) in ESCC and CAN tissues. (E) showed high MVD in Kazakh ESCC tissues. (F) showed low MVD in Kazakh ESCC tissues.",83e3f1cf-8b40-4e8e-a9f1-925ca28ec1ee.jpg,pubmed,train,,,,,,,,,0,1
81,Inflammatory process is destroying the muscles.,rW3fQn21HPk_image_8e9465d0-f54b-45d5-a565-884ed99c6808.jpg,quilt,train,"['Hematopathology', 'Neuropathology', 'Soft tissue']","['Muscles are being destroyed by an inflammatory process.', 'Muscles are being destroyed by an inflammatory process.']"," controlling the muscle we just saw, are being destroyed. They are being destroyed by an inflammatory process. The chief and most common inflammatory process involving motor neurons of the anterior or ventral horns is the poliovirus. This is poliomyelitis of the anterior horn of the"," controlling the muscle we just saw, are being destroyed. They are being destroyed by an inflammatory process. The chief and most common inflammatory process involving motor neurons of the anterior or ventral horns is the poliovirus. This is poliomyelitis of the anterior horn of the","[[{'entity': 'Inflammatory process', 'concept_id': 'C1155266', 'confidence': 0.8608354926109314}, {'entity': 'destroying', 'concept_id': 'C1948029', 'confidence': 1.0}, {'entity': 'muscles', 'concept_id': 'C0026845', 'confidence': 1.0}], [{'entity': 'Motor neurons', 'concept_id': 'C0026609', 'confidence': 1.0}, {'entity': 'anterior', 'concept_id': 'C0205094', 'confidence': 1.0}, {'entity': 'ventral horns', 'concept_id': 'C0019939', 'confidence': 0.7838873863220215}, {'entity': 'affected', 'concept_id': 'C0392760', 'confidence': 0.9999998807907104}, {'entity': 'poliovirus', 'concept_id': 'C0206435', 'confidence': 1.0}], [{'entity': 'Poliomyelitis', 'concept_id': 'C0032371', 'confidence': 0.9999999403953552}, {'entity': 'anterior', 'concept_id': 'C0205094', 'confidence': 1.0}, {'entity': 'horn', 'concept_id': 'C0019939', 'confidence': 1.0}]]",2.0,480.0,540.0,0,0
82,Motor neurons of the anterior or ventral horns are commonly affected by poliovirus.,rW3fQn21HPk_image_8e9465d0-f54b-45d5-a565-884ed99c6808.jpg,quilt,train,"['Hematopathology', 'Neuropathology', 'Soft tissue']","['Muscles are being destroyed by an inflammatory process.', 'Muscles are being destroyed by an inflammatory process.']"," controlling the muscle we just saw, are being destroyed. They are being destroyed by an inflammatory process. The chief and most common inflammatory process involving motor neurons of the anterior or ventral horns is the poliovirus. This is poliomyelitis of the anterior horn of the"," controlling the muscle we just saw, are being destroyed. They are being destroyed by an inflammatory process. The chief and most common inflammatory process involving motor neurons of the anterior or ventral horns is the poliovirus. This is poliomyelitis of the anterior horn of the","[[{'entity': 'Inflammatory process', 'concept_id': 'C1155266', 'confidence': 0.8608354926109314}, {'entity': 'destroying', 'concept_id': 'C1948029', 'confidence': 1.0}, {'entity': 'muscles', 'concept_id': 'C0026845', 'confidence': 1.0}], [{'entity': 'Motor neurons', 'concept_id': 'C0026609', 'confidence': 1.0}, {'entity': 'anterior', 'concept_id': 'C0205094', 'confidence': 1.0}, {'entity': 'ventral horns', 'concept_id': 'C0019939', 'confidence': 0.7838873863220215}, {'entity': 'affected', 'concept_id': 'C0392760', 'confidence': 0.9999998807907104}, {'entity': 'poliovirus', 'concept_id': 'C0206435', 'confidence': 1.0}], [{'entity': 'Poliomyelitis', 'concept_id': 'C0032371', 'confidence': 0.9999999403953552}, {'entity': 'anterior', 'concept_id': 'C0205094', 'confidence': 1.0}, {'entity': 'horn', 'concept_id': 'C0019939', 'confidence': 1.0}]]",2.0,480.0,540.0,0,0
83,Poliomyelitis affects the anterior horn.,rW3fQn21HPk_image_8e9465d0-f54b-45d5-a565-884ed99c6808.jpg,quilt,train,"['Hematopathology', 'Neuropathology', 'Soft tissue']","['Muscles are being destroyed by an inflammatory process.', 'Muscles are being destroyed by an inflammatory process.']"," controlling the muscle we just saw, are being destroyed. They are being destroyed by an inflammatory process. The chief and most common inflammatory process involving motor neurons of the anterior or ventral horns is the poliovirus. This is poliomyelitis of the anterior horn of the"," controlling the muscle we just saw, are being destroyed. They are being destroyed by an inflammatory process. The chief and most common inflammatory process involving motor neurons of the anterior or ventral horns is the poliovirus. This is poliomyelitis of the anterior horn of the","[[{'entity': 'Inflammatory process', 'concept_id': 'C1155266', 'confidence': 0.8608354926109314}, {'entity': 'destroying', 'concept_id': 'C1948029', 'confidence': 1.0}, {'entity': 'muscles', 'concept_id': 'C0026845', 'confidence': 1.0}], [{'entity': 'Motor neurons', 'concept_id': 'C0026609', 'confidence': 1.0}, {'entity': 'anterior', 'concept_id': 'C0205094', 'confidence': 1.0}, {'entity': 'ventral horns', 'concept_id': 'C0019939', 'confidence': 0.7838873863220215}, {'entity': 'affected', 'concept_id': 'C0392760', 'confidence': 0.9999998807907104}, {'entity': 'poliovirus', 'concept_id': 'C0206435', 'confidence': 1.0}], [{'entity': 'Poliomyelitis', 'concept_id': 'C0032371', 'confidence': 0.9999999403953552}, {'entity': 'anterior', 'concept_id': 'C0205094', 'confidence': 1.0}, {'entity': 'horn', 'concept_id': 'C0019939', 'confidence': 1.0}]]",2.0,480.0,540.0,0,0
84,Another example of a large object propelled into glomerular capillaries. A nest of clear cell RCC from a tumor nephrectomy in one of the adjacent glomeruli. GUpath coolfindingsinadjcentnonneoplasticparenchyma tissuetearkindaruinsthatotherwisenicepic,961926666024079360_0.jpg,openpath,train,,,,,,,,,0,1
